"ID","Joke";
2312,"If a man talks dirty to a woman, that's sexual harassment. If a woman talks dirty to a man, that'll be $6.50 a minute.";


2313,"Whenever I find the key to success, someone changes the lock.";


2314,"All those years of getting horrible elementary school pictures was just society's way of preparing you for your driver's license photo.";


2315,"I want to be something really scary for Halloween this year so I'm dressing up as a phone battery at 2%.";


2316,"Masturbating is wrong in some people's eyes... Also, it burns.";


2317,"The only thing worse than seeing something done wrong is seeing it done slowly.";


2318,"What's the difference between a bowling ball and a blonde? You can only fit three fingers inside a bowling ball!";


2319,"They say you are what you eat, so lay off the nuts.";


2320,"People who make you feel special are keepers.  Anyone with such good taste has to be admired.";


2321,"Latest survey shows that 3 out of 4 people make up 75% of the world's population.";


2322,"Don't spell part backwards. It's a trap.";


2323,"Cancer cures smoking.";


2324,"Behind every fat woman there is a beautiful woman. No seriously, your in the way.";


2325,"Five Secrets of Successful People:1. Don't 2. Tell 3. Anyone 4. Your 5. Secrets";


2326,"We can always tell when you are lying. Your lips move.";


2327,"Crowded elevators smell different to midgets.";


2328,"How come ""you're a peach"" is a complement but ""you're bananas"" is an insult? Why are we allowing fruit discrimination to tear society apart?";


2329,"If a turtle doesn't have a shell, is he homeless or naked?";


2330,"Those of you who think you know it all are damn annoying to those of us who do!";


2331,"Aging gracefully is like the nice way of saying you're slowly looking worse.";


2332,"The good Lord didn't create anything without a purpose, but mosquitoes come close.";


2333,"Are you made of beryllium, gold, and titanium? You must be because you are BeAuTi-ful.";


2334,"Sorry I didn't text you back, but my phone recognized your number.";


2335,"I have one of those unlimited cell phone plans. There's no limit to how much they can charge me.";


2336,"Who is the most popular guy at the nudist colony? The guy who can carry a cup of coffee in each hand and a dozen donuts.";


2337,"What do men and mascara have in common? They both run at the first sign of emotion.";


2338,"I'm watching my neighbor through the blinds, he's so creepy.";


2339,"I gave up my seat to a blind person in the bus. That is how I lost my job as a bus driver.";


2340,"He who laughs last thinks slowest.";


2341,"Think Im Sarcastic? Watch Me Pretend To Care!";


2342,"Coffee, Chocolate, Men. Some things are just better rich.";


2343,"Love is the triumph of imagination over intelligence.";


2344,"What's the difference between a bitch and a whore? A whore sleeps with everybody at the party, and a bitch sleeps with everybody at the party except you.";


2345,"What do you call a cheap circumcision? A: a rip off";


2346,"One day you will meet someone so amazing in every way who will want absolutely nothing to do with you.";


2347,"Forget hydrogen, you're my number one element.";


2348,"What's a man's idea of foreplay? A half hour of begging.";


2349,"This isn't working out. I think we should start making other people miserable.";


2350,"Did Noah include termites on the ark?";


2351,"A bus station is where a bus stops. A train station is where a train stops. On my desk, I have a work station..";


2352,"I need a new bank account. This one has run out of money.";


2353,"I grew a beard thinking it would say ""Distinguished Gentleman."" Instead, turns out it says, ""Senior Discount, Please!";


2354,"Last time I got caught stealing a calendar I got 12 months.";


2355,"Every time someone calls me fat I get so depress I cut myself... a piece of cake.";


2356,"Laughing stock: cattle with a sense of humor.";


2357,"I'm new in town. Could you give me directions to your apartment?";


2358,"Why did the blonde stare at a frozen orange juice can for 2 hours? Because it said ""concentrate""! ";


2359,"What's the difference between a woman having her period and a terrorist? You can negotiate with a terrorist";


2360,"If a stranger offers you a piece of candy...take two.";


2361,"Sarcasm is just one more service we offer.";


2362,"I put the ""fun"" in dysfunctional. ";


2363,"Having sex is like playing bridge. If you don't have a good partner, you'd better have a good hand.";


2364,"Republicans & Democrats are like divorced parents who care more about getting the kids to hate the other one than they are their well-being.";


2365,"If you think nobody cares if you're alive, try missing a couple of payments.";


2366,"Five days of the week, my body is a temple. The other two, it's an amusement park! ";


2367,"The difference between in-laws and outlaws? Outlaws are wanted.";


2368,"I have the body of a 25 year old supermodel, but it takes up too much space in my freezer.";


2369,"Why do men like masturbation? It's sex with someone they love.";


2370,"Money isn't everything but it sure keeps you in touch with your children.";


2371,"Maybe you need a ladder to climb out of my business?";


2372,"We just got a fax. At work. We didn't know we had a fax machine. The entire department just stared at it. I poked it with a stick.";


2373,"Fridges should have glass doors.That way i dont have to stand with the fridge door open trying to figure out my next move.";


2374,"I'm as bored as a slut on her period.";


2375,"Which day do chickens hate the most? Friday.";


2376,"You can easily judge the character of a man by how he treats those who can do nothing for him.";


2377,"I don't find it hard to meet expenses. They're everywhere.";


2378,"I don't suffer from insanity. I enjoy every minute of it.";


2379,"A donkey fell into a bowl of sugar. Now that's a sweet ass.";


2380,"Anyone who says ""good morning"" on a Monday is a sociopath.";


2381,"Nobody is interested in your sorrow, unless you can make a joke or a poem out of it.";


2382,"You've got two brain cells: one is in a wheelchair and the other one is pushing.";


2383,"I saw a guy on his motorcycle and the back of his shirt said ""If you can read this the b*tch fell off.";


2384,"Unfortunately, but sometimes a woman can't find herself a man. She doesn't like the drunken ones, and the sober ones doesn't like her.";


2385,"Why name hurricanes lame names, like Sandy? Name that shit Hurricane Death Megatron 300 and I guarantee niggas be evacuating like they need to.";


2386,"The sex was so good that even the neighbors had a cigarette.";


2387,"How can you tell when the Mexicans have moved into your neighborhood? The Blacks get car insurance.";


2388," Did you hear about the guy who died of a Viagra overdose? They couldn't close his casket.";


2389,"A hole was found in the wall of a nudist camp. The police are looking into it.";


2390,"I love my life, but it just wants to be friends...";


2391,"Me: Real women don't care about romantic cliches. My internal voice: Please buy me flowers, please buy me flowers, please buy me flowers.";


2392,"I'm never wrong! One time, I thought I was wrong, but I was mistaken!";


2393,"By the time a man realises that his father was right, he has a son who thinks he's wrong.";


2394,"Start every day off with a smile and get it over with.";


2395,"Join The Army, visit exotic places, meet strange people, then kill them.";


2396,"If we aren't supposed to eat animals, why are they made with meat?";


2397,"ISIS is taking back territory after a surprise turn of events. Their new partnership with Samsung is quickly paying off";


2398,"Why did Eve bite the forbidden apple? Because it tasted better than Adam's banana. ";


2399,"However lonely you feel, you're never alone. There are literally millions of bugs, mites and bacteria living in your house. Goodnight.";


2400,"Everyone has a photographic memory, some don't have film.";


2401,"Never marry a woman who was captain of the debate team.";


2402,"I found a rock yesterday which measured 1760 yards in length. Must be some kind of milestone.";


2403,"For Sale: Parachute. Only used once, never opened.";


2404,"I typed ""married"" but it was auto-corrected to ""martyred"". Damn,smartphone has gained intelligence.";


2405,"Only dead fish go with the flow.";


2406,"What a lovely surprise to finally discover how unlonely being alone can be.";


2407,"Raccoons""? Oh, you mean garbage pandas?";


2408,"Remember: What dad really wants is a nap. Really.";


2409,"If Barbie is so popular, why do you have to buy her friends?";


2410,"Deja Vu  When you think you're doing something you've done before, it's because God thought it was so funny, he had to rewind it for his friends.";


2411,"Tell me again how I unloaded the dishwasher too loudly when you were watching golf. Detectives will want to know exactly how this went down.";


2412,"I've just written a song about tortillas - actually, it's more of a rap.";


2413,"Men don't realize that if we're sleeping with them on the first date, we're probably not interested in seeing them again either.";


2414,"If every day is a gift, I'd like a receipt for Monday. I want to exchange it for another Friday.";


2415,"Oh, what? Sorry. I was trying to imagine you with a personality. ";


2416,"If you are here - who is running hell?";


2417,"Programming is like sex; one mistake and you have to support for a lifetime.";


2418,"1 in 5 people in the world are Chinese. There are 5 people in my family, so it must be one of them. It's either my mum or my dad. Or my older brother Colin. Or my younger brother Ho-Cha-Chu. But I think it's Colin.";


2419,"What's the difference between men and government bonds? Bonds mature.";


2420,"Life is scary; at least the salary is funny.";


2421,"Why is it so hard for women to find men that are sensitive, caring, and good-looking? Because those men already have boyfriends.";


2422,"If anything is possible, is it possible for something to be impossible?";


2423,"I'm the type of person who tries to fall back asleep in the morning, just to finish a dream.";


2424,"A camel can work 10 days without drinking, I can drink 10 days without working.";


2425,"Lazy People Fact #5812672793. You were too lazy to read that number.";


2426,"Just because you have one doesn't mean you have to act like one.";


2427,"If God is your co-pilot - swap seats.";


2428,"Fishermen are reel men.";


2429," I'm not an alcoholic. Alcoholics need a drink, but I already have one.";


2430,"How long have I been working for this company? Ever since they threatened to fire me.";


2431,"Barking dog at the back door wanting in and your wife's yelling at the front wanting in. Which one do you let in? The dog, once he's in, he shuts up!";


2432,"Nothing says' I love my dog' quite like spending more money on his haircut than you do your own.";


2433,"The problem with trouble shooting is that trouble shoots back.";


2434,"Why do blondes wear underwear? To keep their ankles warm.";


2435,"Sex takes up the least amount of time and causes the most amount of trouble.";


2436,"I like to show my girlfriend who's boss in our house by holding a mirror up to her face.";


2437,"It's scary to think that people like you are graduating from college.";


2438,"My wife and I had a two-hour fight about whether or not we were fighting.";


2439,"I love every bone in your body, especially mine.";


2440,"If you don't drink, smoke or do drugs you may live long enough to be a real burden to loved ones.  Please pass the wine.";


2441,"Sorry, my dog ate your text message.";


2442,"I tried to get back to the drawing board but I can't draw.";


2443,"What do you call a magic dog? A Labracadabrador.";


2444,"Never give yourself a haircut after three margaritas.";


2445,"What did the duck say when he bought lipstick? ""Put it on my bill.";


2446,"Sex is like air; its not important unless you arent getting any.";


2447,"According to the second law of thermodynamics, you're supposed to share your hotness with me.";


2448,"So apparently RSVP'ing back to a wedding invite 'maybe next time' isn't the correct response.";


2449,"Depression: A period during which we have to get along without the things our grandparents never dreamed of.";


2450,"If you do not say it, they can't repeat it.";


2451,"Be careful of your thoughts, they may become words at any moment.";


2452,"668  The neighbour of the beast.";


2453,"They say people couldn't have everything because they don't have enough space to put it, I say 'everything' includes a bag with infinite space so I can put everything in easily.";


2454,"Nostalgia isn't what it used to be.";


2455,"Q: What did the nurse say to John Cena? A: ICU.";


2456,"My wife is not buying that autocorrect changed ""You're psychic"" to ""You're psycho.";


2457,"The difference between an oral thermometer and a rectal thermometer is in the taste.";


2458,"I am not the kind of girl you can take home to your wife.";


2459,"I'm currently boycotting any company that sells items I can't afford.";


2460,"Roses are red, violets are blue, sugar is sweet and so are you. But roses are wilting, violets are dead, sugar bowl's empty and so is your head.";


2461,"Secret: Something which is told to one person at a time.";


2462,"The only substitute for good manners is fast reflexes.";


2463,"26.8 percent of all statistics are made up on the spot.";


2464,"Age is important only if you're cheese and wine.";


2465,"My mind is like a steel trap. Rusty and illegal in 37 states.";


2466,"If we put aside our differences and work together, I truly believe we can come up with a few more alternate spellings of the name Britney.";


2467,"I always give 110%. Oops. Left out the decimal point. I always give 1.10%.";


2468,"I won $3 million on the lottery this weekend so I decided to donate a quarter of it to charity. Now I have $2,999,999.75.";


2469,"Crime doesn't pay... does that mean that my job is a crime?";


2470,"I like to hold hands at the movies... which always seems to startle strangers.";


2471,"He slapped his two inches on the doctors desk. The doctor said ""What is wrong with it?"" ""It's swollen.";


2472,"Don't worry guys, my wife just turned the car radio down so we shouldn't be lost much longer.";


2473,"America where we celebrate Memorial Day with mattress sales.";


2474,"My wife had me take out more life insurance and now there's no grip left on the bath mat. Weird.";


2475,"Whats long and hard and has cum in it? A cucumber.";


2476,"A little boy asked his father, ""Daddy, how much does it cost to get married?"" Father replied, ""I don't know son, I'm still paying.";


2477,"What did the tree say to autumn? Leaf me alone.";


2478,"I'm not lazy... I'm just on my energy saving mode.";


2479,"How are tornadoes and marriage alike? They both begin with a lot of sucking and blowing, and in the end you lose your house.";


2480,"There's a fine line between cuddling and holding someone down so they can't get away.";


2481,"I love being married. It's so great to find that one special person you want to annoy for the rest of your life. ";


2482,"Occasionally, a true friend gives his paw not his hand...";


2483,"Get married early in the morning. That way, if it doesn't work out, you haven't wasted a whole day.";


2484,"Everything you do you're gonna regret. But if you do nothing  you will not only regret but will also suffer.";


2485,"What tea do hockey players drink? Penaltea!";


2486,"My IQ came back negative.";


2487,"An average teenage boy nowadays has seen more naked women than all of their ancestors put together.";


2488,"I always put in a full eight hours at work. Spread out over the course of the week.";


2489,"Just took a power nap on a park bench. Made $7.30 in change.";


2490,"Some people are only alive because it is illegal to shoot them.";


2491,"I hate when people use words without knowing the meaning... gives me a huge hysterectomy on the side of my head.";


2492,"Virginity is like a soapbubble, one prick and it is gone.";


2493,"We must be subatomic particles, because I feel strong force between us.";


2494,"Why do Americans choose from just two people to run for president and 50 for Miss America?";


2495,"We can't help everyone, but everyone can help someone.";


2496,"Did you know that your body is made 70% of water? And now I'm thirsty.";


2497,"Why do men name their penises? Because they don't like the idea of having a stranger make 90% of their decisions.";


2498,"The difference between true love and dinosaurs: We're sure that dinosaurs once existed on this earth.";


2499,"I saw six men kicking and punching the mother-in-law. My neighbour said Are you going to help?' I said No, six should be enough.'";


2500,"On the other hand, you have different fingers.";


2501,"Dont stop! I dont usually get to see beauty in motion";


2502,"My love for you is like dividing by zero - it cannot be defined.";


2503,"If Mayans could predict the future, why didn't they predict their extinction?";


2504,"Your gene pool could use a little chlorine.";


2505,"Plan ahead - It wasn't raining when Noah built the ark.";


2506,"I was going to quit all my bad habits for the new year, but then I remembered that nobody likes a quitter.";


2507,"I always knew that I could never be a lawyer because of my inability to pass a bar.";


2508,"I never loved you any more than I do, right this second. And I'll never love you any less than I do, right this second.";


2509,"Never go to bed angry, stay awake and plot your revenge. ";


2510,"I wonder how many miles I've scrolled with my thumb.";


2511,"People who live in stone houses shouldn't throw glasses.";


2512,"Childhood is like being drunk, everyone remembers what you did, except you.";


2513,"Updating your relationship status in public is fine. Updating your relationship problems in public is stupidity.";


2514,"I eat the broken cookies first because I feel bad for them.";


2515,"It's so simple to be wise. Just think of something stupid to say and then don't say it.";


2516,"I get it ladies, I had abs before I had kids too.";


2517,"Why do people keep running over a string a dozen times with their vacuum cleaner, then reach down, pick it up, examine it, then put it down to give their vacuum one more chance?";


2518,"College is the opposite of kidnapping. They demand $100,000 from you or they'll send your kid back.";


2519,"You should argue with your wife only when she's not around.";


2520,"Most guys walk up and stick it in... I stick it in then walk up...";


2521,"The end of a relationship isn't the worst thing. It's worse when it doesn't end after the end.";


2522,"Dating a single mother is like continuing from somebody else's saved game.";


2523,"Is everything expensive or I'm just poor?";


2524,"As best man it is my job to tell you about the groom, and all the embarrassing things that have happened to him in the 28 years leading up to what was the happiest day of his life until i started this speech.";


2525,"Sometimes, when I close my eyes, I... can't see.";


2526,"Laugh alone and the world thinks you're an idiot.";


2527,"I think I'll tell my kids that the Titanic sunk because Jack and Rose had sex before marriage.";


2528,"I believe in respect for the dead; in fact, I could only respect you if you WERE dead.";


2529,"Baby, if you were a fruit you'd be a fineapple.";


2530,"A garage sale is actually a Garbage sale but the ""b"" is silent.";


2531,"Efficiency is a highly developed form of laziness.";


2532,"The early bird might get the worm, but the second mouse gets the cheese.";


2533,"What color do Smurfs turn if you choke them?";


2534,"Evening news is where they begin with Good evening', and then proceed to tell you why it isn't.";


2535,"Some people are like Slinkies ... not really good for anything, but you can't help smiling when you see one tumble down the stairs.";


2536,"The voices in my head may not be real, but they have some good ideas!";


2537,"My wife told me to stop impersonating a flamingo. I had to put my foot down.";


2538,"My brain is not equipped with facial or name recognition technology.";


2539,"We live in an age where mentioning you read a book seems a little bit like you're showing off.";


2540,"Shin: A device for finding furniture in the dark.";


2541,"Life is an internet. 30 days after you met she wants you to register and begins taking taxes every month.";


2542,"Why do they lock gas station bathrooms? Are they afraid someone will clean them?";


2543,"If you're looking for the best time to spill things on yourself, might I suggest wearing a white shirt and right before an interview.";


2544,"If you can stay calm while all around you is chaos, then you probably haven't completely understood the situation.";


2545,"Well aren't you a waste of two billion years of evolution.";


2546,"I got fired from my job as a chef for stealing kitchen equipment. It's a whisk I was willing to take.";


2547,"I drive way too fast to worry about cholesterol.";


2548,"Upgrade your weekend: Take Monday Off...";


2549,"If a person told you they were a pathological liar, should you believe them?";


2550,"Don't trust atoms, they make up everything.";


2551,"Strangers have the best candy.";


2552,"The sole purpose of a child's middle name, is so he can tell when he's really in trouble.";


2553,"My dream woman has a special combination of inner and outer beauty and is, most importantly, too naive to know she's way out of my league.";


2554,"What lies at the bottom of the ocean and twitches? A nervous wreck.";


2555,"Consciousness: That annoying time between naps.";


2556,"I sometimes go to my own little world, but that's okay, they know me there.";


2557,"Took my dog to a bonfire and as he sat there staring at it blankly I realized he loves sticks. I was burning a giant pile of his toys.";


2558,"What did the blonde say when she saw Cheerios? Donut seeds.";


2559,"THANKS TO YOU I have learned that my prayers only get answered if I forward an e-mail to seven of my friends and make a wish within five minutes.";


2560,"When I was born, the doctor came out to the waiting room and said to my father, ""I'm very sorry. We did everything we could. But he pulled through.";


2561,"Fuck me if I'm wrong, but isn't your name Cindrella?";


2562,"My friends say that I'm gay because I don't like football. What a bunch of idiots. I'm gay because I like cock.";


2563,"If your going to be two faced at least make one of them pretty.";


2564,"How do people lose their kids at the mall? Seriously, any tips would be greatly appreciated.";


2565,"Never answer an anonymous letter.";


2566,"Life without women would be a pain in the ass, literally.";


2567,"No Deja vu please...I Don't want to go through that again";


2568,"Before I buy a leaf blower I want to make sure I understand the rules. We just blow the leaves at each other's houses, right?";


2569,"The kiss is a wordless articulation of desire whose object lies in the future, and somewhat to the south.";


2570,"What do sea monsters eat for lunch? Fish and ships.";


2571,"Whenever you get mad, just think of a t-rex trying to masturbate.";


2572,"What did the elephant say to the naked man? How do you breathe through that tiny thing?";


2573,"Why wasnt there any blacks in the flintstones? Because they were still monkeys.";


2574,"Blind man walks into a bar... And a table, and a chair.";


2575,"Slept like a log last night... Woke up in the fireplace. ";


2576,"don't regret doing things, regret getting caught";


2577,"A diplomat is a man who always remembers a woman's birthday but never remembers her age.";


2578,"99% of women say they don't like men who wear leather pants. Which works out perfectly, since 100% of men who wear leather pants don't like women.";


2579,"Scientists proved that cows don't give us meat and milk. We just take it from them!";


2580,"I wasn't planning on giving Christmas gifts this year until I heard about those exploding Samsung Galaxy phones.";


2581,"Are you always this stupid or is today a special occasion?";


2582,"Beauty is only skin deep ...but ugly goes all the way to the bone!";


2583,"Sure, white people can't say the ""N word"" but at least we can say phrases like, ""Thanks for the warning, Officer"" and, ""Hey, Dad.";


2584,"Did you fall from heaven? Cause your face is pretty messed up!";


2585,"You have the perfect face for radio.";


2586,"What is the difference between snowmen and snowwomen? Snowballs.";


2587,"The older I get, the earlier it gets late.";


2588,"There are two types of guys: those who pee in the shower and those who don't admit it.";


2589,"Why did the duck go to rehab? Because he was a quack addict!";


2590,"Girls are like roads, more the curves, more the dangerous they are.";


2591,"A woman never wakes up her second baby just to see it smile.";


2592,"The five most essential words for a healthy, vital relationship ""I apologize"" and ""You are right.";


2593,"Chaos, panic, & disorder - my work here is done.";


2594,"Why kill time when you can make it work for you?";


2595,"What do electric trains and women's breasts have in common? They were originally intended for children but it's the men who play with them the most.";


2596,"Every function without you will always be void of love.";


2597,"A friend is like a book: you don't need to read all of them, just pick the best ones.";


2598,"Why does the Law society prohibit sex between lawyers and their clients? To prevent clients from being billed twice for essentially the same service! ";


2599,"Secret to success is to know who to blame for your failures.";


