"ID","Joke";
3190,"How can you tell soap operas are fictional? In real life, men aren't affectionate out of bed. ";


3191,"Salary is like a period  you wait for it a whole month and it ends in a week.";


3192,"Suicide: Mans way of telling God - ""You can't fire me, I quit"".";


3193,"Girl, if you were a dinosaur, you'd be a Gorgeousaurus";


3194,"You are not even beneath my contempt.";


3195,"What's the difference between oral sex and anal sex? Oral sex makes your day, anal sex makes your hole weak.";


3196,"Learn from your parents' mistakes: use birth control.";


3197,"What is the difference between a clever midget and a venereal disease? One is a cunning runt, and the other is a running c*nt.";


3198,"If someone notices you with an open zipper, answer proudly: professional habit.";


3199,"I will have enough money for the rest of my life. Of course, if I don't buy and eat anything.";


3200,"Virginity is curable.";


3201,"What's the difference between a new husband and a new dog? After a year, the dog is still excited to see you.";


3202,"Dad always thought laughter was the best medicine, which I guess is why several of us died of tuberculosis.";


3203,"Are my undies showing? [""No.""] ""Would you like them to?";


3204,"HOW DO I TURN OFF CAPS LOCK? I ACCIDENTALLY TURNED IT ON YESTERDAY AND I DON'T KNOW HOW TO TURN IT BACK OFF. ALL MY FRIENDS ARE MAD BECAUSE THEY THINK I AM SHOUTING AT THEM OVER INTERNET. PLEASE HELP!!!";


3205,"Burglar gently waking me... ""you live like this?";


3206,"The value of money in a relationship: the 10 bucks that the wife and the tax inspection don't know about are worth more than the 100 that both know about.";


3207,"A person has to have a warm heart and a cold beer.";


3208,"Murdered for immortality. Received life sentence.";


3209,"You know, it's not the length of the vector that counts... it's how you apply the force.";


3210,"How is being at a singles bar different from going to the circus? At the circus, the clowns don't talk.";


3211,"Every 60 seconds in Africa, a minute passes.";


3212,"Here's to alcohol, the cause of  and solution to  all life's problems.";


3213,"I've been waiting for the bus so long, someone just stapled a lost cat flyer to my chest.";


3214,"The farther away the future is, the better it looks.";


3215,"Never, under any circumstances, take a sleeping pill and a laxative on the same night.";


3216,"How is it one careless match can start a forest fire, but it takes a whole box to start a campfire?";


3217,"It's two in the morning.  Do you know where your blankets are?";


3218,"Facebook is telling me to ""reconnect"" with my brother...hmmm, I see him everyday";


3219,"How do you get holy water? Boil the hell out of it.";


3220,"Sometimes when I reflect back on all the beer I drink I feel shamed. Then I look into the glass and think about the workers in the brewery and all of their hopes and dreams. If I didn't drink this beer, they might be out of work and their dreams would be shattered. Then I say to myself, ""It is better that I drink this beer and let their dreams come true than be selfish and worry about my liver.";


3221,"Worrying works! 90% of the things I worry about never happen.";


3222,"Our family motto is ""Who took my phone charger?";


3223,"There's never enough time to do it right, but there's always enough time to do it over.";


3224,"If good things come in small packages, then more good things can come in large packages.";


3225,"Her cooking is so bad, it would make medicine sick!";


3226,"Why is Valentine's Day the best day for a celebration? Because you can really party hearty! ";


3227,"Despite the cost of living, have you noticed how it remains so popular?";


3228,"Have hope for the future, but maybe build a bomb shelter anyway.";


3229,"Going for a walk because I want to stay healthy. Taking along a box of M&M's because let's be honest here.";


3230,"I've pre-planned my funeral to include a 32 minute montage of the times I've accidentally waved hello to someone waving to someone behind me.";


3231,"Relationship status: Autocorrect changes my girl to my grill.";


3232,"I've snagged so many catfish on dating sites, I'm now a licensed fisherman.";


3233,"I return to work tomorrow with a child-like belief that 2017 is the year people will think at least twice before hitting Reply All.";


3234,"You seem like the kind of person who always tried to open the wrong side of the milk carton in grade school.";


3235,"Life's a bitch, 'cause if it was a slut, it'd be easy.";


3236,"He died doing what he loved, checking his mentions while driving.";


3237,"It's amazing that the amount of news that happens in the world everyday always just exactly fits the newspaper.";


3238,"What would we get if we'd cross one nigger and octopus? I have no idea, but it picks cotton like crazy.";


3239,"Son, when I was your age there was no social media. You had to go to a bar and buy endless drinks to be ignored by multiple women.";


3240,"How many light bulbs does it take to change people?";


3241,"He may have a nice car but I have a fast sleigh";


3242,"Ninety-nine percent of lawyers give the rest a bad name.";


3243,"Adult: Someone who has stopped growing at both ends and now grows in the middle.";


3244,"Wanna go on a picnic? Alpaca lunch.";


3245,"It matters not whether you win or lose: what matters is whether I win or lose.";


3246,"What has a head, a tail, and no body? A coin!";


3247,"If you can't convince them, confuse them.";


3248,"Stress is when you wake up screaming and you realize you haven't fallen asleep yet.";


3249,"Lite: the new way to spell ""Light,"" now with 20% fewer letters!";


3250,"When a woman breast feeds in public it's called natural, but when I do it, the woman calls the cops.";


3251,"They were the type of children who would kill both parents and make you feel sorry for them because they were orphans.";


3252,"It's not that I'm afraid to die, I just don't want to be there when it happens.";


3253,"This isn't an office. It's hell with fluorescent lighting.";


3254,"If I get interviewed by a police sketch artists, my only goal will be to see how far I get before he realizes I'm making him draw a pirate.";


3255,"Alcoholism is the only disease that tries to convince you that you don't have it.";


3256,"You're not drunk if you can lie on the floor without holding on.";


3257,"I am now on three dating sites because you can never get enough rejection.";


3258,"Doggies just call it style.";


3259,"I'm busy now. Can I ignore you some other time?";


3260,"Not all men are annoying. Some are dead.";


3261,"I'm rich; what am I supposed to do, hide it?";


3262,"If someone is spitting behind you, it means you're in front.";


3263,"You won't drink away the alcoholism.";


3264,"In principle, I can stop drinking, the thing is  I don't have such a principle.";


3265,"I don't need a reason to enjoy a little wine. I just need a glass.";


3266,"It is said that, a way to a man's heart goes through a stomach. Aha...you might think that men go to their lovers to eat some soup.";


3267,"If you have worked and didn't get anything, it means someone else got it.";


3268,"You and Me = Grand Unification";


3269,"If another woman steals your man, there's no better revenge than to let her keep him. Real men can't be stolen.";


3270,"No matter how bad you are playing, it is always possible to play worse.";


3271,"I run faster horny than you do scared.";


3272,"Miss Anders... I didn't recognise you with your clothes on.";


3273,"What does tightrope walking and getting a blowjob from Grandma have in common? You don't look down.";


3274,"My ex-girlfriend told me nothing shocks her anymore so I switched her digital scale from Lbs to Kg.";


3275,"If homework goes too easy you are doing it wrong.";


3276,"When he proposed to her. She found it very engaging.";


3277,"Monday is an awful way to spend 1/7th of your life.";


3278,"What's the difference between a blonde and a guy? The blonde has the higher sperm count.";


3279,"Women are cursed, and men are the proof.";


3280,"Marrying a divorced man is ecologically responsible. In a world where there are more women than men, it pays to recycle.";


3281,"After the weekend the most difficult task is to remember names... ";


3282,"Haikus are easy. But sometimes they don't make sense. Refrigerator.";


3283,"If corn oil comes from corn, where does baby oil come from?";


3284,"Whats the difference between a jeweler and a jailer? One sells watches and one watches cells.";


3285,"Nice perfume. Must you marinate in it? ";


3286,"My New Years resolution is 1080p.";


3287,"Don't hate me because I'm beautiful. Hate me because your boyfriend thinks so.";


3288,"There are all types of love in this world but never the same love twice.";


3289,"You're wrong! I touched second base. I missed third... but I touched second.";


3290,"A man's idea of serious commitment is usually, ""Oh alright, I'll stay the night.";


3291,"Sorry, I'm out of my mind at the moment, please leave a message and I'll get back to you as soon as possible. ";


3292,"I'd kill for a Nobel Peace Prize.";


3293,"Keep your eyes wide open before marriage, half shut afterwards.";


3294,"I discovered I scream the same way whether I'm about to be devoured by a great white shark or if a piece of seaweed touches my foot.";


3295,"With sufficient thrust, pigs fly just fine.";


3296,"A couple years ago my therapist told me I had problems letting go of the past.";


3297,"Your as worthless as, Tits on a boar hog.";


3298,"If at first you don't succeed, skydiving is not for you!";


3299,"I say no to alcohol, it just doesn't listen.";


3300,"I recently read that love is entirely a matter of chemistry. That must be why my wife treats me like toxic waste.";


3301,"Glad I'm not a general, because auto-correct just changed ""lunch order"" to ""launch order.";


3302,"Multitasking: screwing up several things at once.";


3303,"Women will drive miles out of their way to avoid the possibility of getting lost using a shortcut. ";


3304,"If mummies are from egypt, then where are daddies from?";


3305,"IRS: We've got what it takes to take what you've got.";


3306,"I childproofed the house... but they still get in!";


3307,"A consensus means that everyone agrees to say collectively what no one believes individually.";


3308,"The more pregnant I get, the more often strangers smile at me. Why? ""Cause you're fatter than they are.";


3309,"He can't decide whether to have his visor half open or half closed.";


3310,"Seen it all, done it all, can't remember most of it.";


3311,"A sports expert is the guy who writes the best alibis for being wrong.";


3312,"Children: You spend the first 2 years of their life teaching them to walk and talk. Then you spend the next 16 years telling them to sit down and shut-up.";


3313,"I took a course in speed waiting. Now I can wait an hour in only ten minutes.";


3314,"I wondered why the Frisbee was getting bigger, and then it hit me.";


3315,"Brains are wonderful, I wish everyone had one.";


3316,"I pretend to work as long as they pretend to pay me.";


3317,"The human brain is a wonderful thing. It starts working the moment you are born, and never stops until you stand up to speak in public.";


3318,"A woman has the last word in any argument. Anything a man says after that is the beginning of a new argument.";


3319,"I'm selling a parachute  just as new, used only one time, didn't open once.";


3320,"It ain't the jeans that make your butt look fat.";


3321,"Those who live by the sword get shot by those who don't!";


3322,"You're never too old to learn something stupid.";


3323,"Thanks honey for rolling over at 3am and telling me I should get some sleep.In my insomnia stupor that hadn't crossed my mind.";


3324,"You can't buy love, but you pay heavily for it.";


3325,"You're so pretty, you could be in a beer commercial.";


3326,"I just let my mind wander, and it didn't come back.";


3327,"Who was the first to see a cow and think ""I wonder what will happen if I squeeze these dangly things and drink whatever comes out?";


3328,"What's the difference between an Aussie and a Yoghurt? A Yoghurt's got culture!";


3329,"There is no I in Team, but there's always one big A... if you know what I mean.";


3330,"Real men don't cry...tears for real men are only unnecessary liquids in the body.";


3331,"Everybody lies, but it doesn't matter since nobody listens.";


3332,"If people could read my mind, I'd get punched in the face a lot.";


3333,"A friend is someone who will help you move. A GOOD friend is someone who will help you move a dead body.";


3334,"There are two kinds of friends : those who are around when you need them, and those who are around when they need you.";


3335,"Every organisation is perfectly designed to get the results they are getting.";


3336,"Keep honking. I'm reloading.";


3337,"There's a pigeon walking up the driveway. I don't care what he wants. I'm not answering the door.";


3338,"You was sent back to earth from hell becasuse the devil choked on your soul.";


3339,"Kids asked if they could do something & I said yes so my wife lowered my security clearance & now I'm not authorized to make those decisions";


3340,"That one liner 'i'm not drinking too much tonight' never goes as planned...";


3341,"When you try to prove to someone that something doesn't work, it will.";


3342,"The best way to remember your wife's birthday is to forget it once.";


3343,"Why does a blonde wear green lipstick? Because red means Stop.";


3344,"Einstein used science to get laid; that guy is a genius... I've been using money.";


3345,"How to lose an argument with a woman: 1) Argue.";


3346,"Why do they say that eating yogurt and oysters will improve your sex life? Because if you'll eat that stuff, you'll eat anything.";


3347,"Marriage is like a coffin and each kid is another nail.";


3348,"What is the best evidence that Microsoft has a monopoly? Santa Claus had to switch from Chimneys to Windows.";


3349,"Can I buy you a drink, or do you just want the money?";


3350,"If God hadn't meant the pussy to be eaten, he wouldn't have made it look like a taco.";


3351,"What is the difference betwen a blonde and a Lamborghini? You don't let your friends borrow your Lamborghini.";


3352,"Why is 68 the maximum speed for blondes? Because at 69 they blow a rod.";


3353,"Life's a jungle let's go to your place and fuck like animals!";


3354,"What is a blonde's favorite color? Glitter.";


3355,"Some people are kind, polite, and sweet-spirited until you try to sit in their pews.";


3356,"For those who never forget a face, you are an exception.";


3357,"Before the wedding I have loved all the women on earth, after the wedding one woman less.";


3358,"When people don't make sense, listen to music. It always does.";


3359,"It's uncomfortable when the neighbor's kids look like you.";


3360,"What's the difference between Tiger Woods and Santa? Santa stopped at 3 ho's.";


3361,"How does a man take a bubble bath? He eats beans for dinner.";


3362,"Are you Christmas, because I want to Merry you.";


3363,"Do you love me because I am beautiful or I am I beautiful because you love me?";


3364,"Everyone has the right to be stupid, but you are abusing the privilege!";


3365,"My wife's maggot soup surprise is better than it used to be now that it is topped with coal ash.";


3366,"Maths and Girls are the most complicated things, but Maths at least has some logic.";


3367,"I was so sad and crying when I lost my playstation 3 but unfortunately, there was nobody to console me!";


3368,"One day I shall solve my problems with maturity. Today, however, it will be alcohol.";


3369,"If it ain't broke, I haven't borrowed it yet.";


3370,"Me: let's go this way. Shopping cart: no.";


3371,"During sex, my girlfriend always wants to talk to me. Just the other night she called me from a hotel.";


3372,"I like long walks, especially when they are taken by people who annoy me.";


3373,"My colleague can no longer attend next weeks Innuendo Seminar so I have to fill her slot instead.";


3374,"Some cause happiness wherever they go. Others whenever they go.";


3375,"Q: Why are all blacks fast? A: The slow ones are in jail.";


3376,"I am not an alcoholic. I simply enjoy living in liquid medium.";


3377,"If the other driver had stopped a few yards behind himself the accident would not have happened.";


3378,"Q: What do you call a bench full of white people?A: The MLB.";


3379,"If your wife wants to learn to drive, don't stand in her way.";


3380,"Why did God give men penises? So they'd have at least one way to shut a woman up.";


3381,"She's so fat, she's got more chins than a Chinese phone book.";


3382,"Smoking is a slow death! But we're not in a hurry...";


3383,"I'll never forget my grandpa's final words, ""stop shaking the ladder you cunt.";


3384,"I fell in love at first sight. I should have looked twice.";


3385,"Which of Santa's reindeers needs to mind his manners the most? ""Rude""olph";


3386,"The hardest part of getting a girls phone number is working up the courage to go through her trash and get it.";


3387,"Sit down, give your mind a rest - it obviously needs it.";


3388,"What's your amplitude for charm-strange mixing?";


3389,"That awesome moment when you open the fridge and the first thing you see is the thing you wanted to eat.";


3390,"I got in a fight one time with a really big guy, and he said, ""I'm going to mop the floor with your face."" I said, ""You'll be sorry."" He said, ""Oh, yeah? Why?"" I said, ""Well, you won't be able to get into the corners very well.";


3391,"Dear men, if you stopped seeing your wife as a woman, it doesn't mean that all men are blind.";


3392,"Don't put a question mark where God put a period. ";


3393,"Q: What do you call a bunch of dead black people in a barn? A: Out dated farming equipment.";


3394,"What travels around the world but stays in one corner? A stamp. ";


3395,"When you get to your wit's end, You'll find God lives there.";


3396,"Why doesn't a blonde talk during sex? Because her mother told her never to talk to strangers.";


3397,"When we were together, you always said you'd die for me. Now that we've broke up, I think it's time you kept your promise!";


3398,"Sex on tv can't hurt unless you fall off.";


3399,"When you want to marry a beautiful, a smart and a rich woman  marry three times.";


3400,"Why'd the semen cross the road? I wore the wrong pair of socks.";


3401,"Why do men become smarter during sex? Because they are plugged into a genius.";


3402,"I'm on a whiskey diet. I've lost three days already.";


3403,"What is the difference between a battery and a woman? A battery has a positive side.";


3404,"Error, no keyboard. Press F1 to continue.";


3405,"Why do the Scottish wear kilts? Because a sheep can hear a zipper from like a mile away.";


3406,"If pronouncing my b's as v's makes me sound Russian, then soviet.";


3407,"A liberal is just a conservative that hasn't been mugged yet.";


3408,"I don't worry about terrorism. I was married for two years.";


3409,"Why is lettuce the most loving vegetable? Because it's all heart. ";


3410,"Just got a booty call from life, apparently it still wants to keep fucking me.";


3411,"He: So then, what's your sign? She: Dollar. ";


3412,"If you can't buy a person, you can always sell him.";


3413,"How do we not know what women want yet? There are tons of conflicting lists all over the internet.";


3414,"I became a vegetarian  switched to weed.";


3415,"Another World's Oldest Man has died. This is beginning to look suspicious.";


3416,"The dogs bark but the caravan moves on.";


3417,"Wanna measure the coefficient of static friction between us?";


3418,"How do you get a sweet little 80-year-old lady to say the F word? Get another sweet little 80-year-old lady to yell *BINGO*!";


3419,"If your dog is barking at the back door and your wife is yelling at the front door, who do you let in first? The dog, of course. He'll shut up once you let him in.";


3420,"Me: *sneaks out of the house* *drives to another state* *hides in a cave* *quietly opens a bag of chips* My kids: Can we have some?";


3421,"Because it would be hilarious,"" is probably not a good reason to elect someone to be president.";


3422,"Only an ass can be divided in half.";


3423,"Silence doesn't mean your sexual performance left her speechless.";


3424,"I feel like Tampax  at a good place, but wrong time...";


3425,"How do hens always know what size your egg cup is? They don't but all eggs always fit.";


3426,"I park in the farthest spot possible at the gym for the added benefit of eating my croissan'wich without being judged by people walking by.";


3427,"You have the nicest syntax I've ever seen.";


3428,"Nobody works harder than a drunk person trying to carefully whisper a secret.";


3429,"What do you call a black with no arms? Trustworthy.";


3430,"Why are men like cars? Because they always pull out before they check to see if anyone else is cumming.";


3431,"Kids, you tried your best and you failed miserably. The lesson is, never try.";


3432,"I thought you'd be flattered that my dog found your leg so attractive.";


3433,"Lets unzip our genes and see if we can share codes together.";


3434,"Men will brag that there are women waiting by the phone at this very moment for their call. Who are these women? Women working at 900 numbers.";


3435,"Why did the students eat their homework? Because the teacher said that it was a piece of cake.";


3436,"My birth certificate was a letter of apology that my dad got from the condom company...";


3437,"What's the difference between a blonde and a computer? You only have to punch information into a computer once. ";


3438,"Please, keep talking. I always yawn when I am interested.";


3439,"Why do vegetarians give good head? Because they are used to eating nuts!";


3440,"I like kids, but I don't think I could eat a whole one.";


3441,"Why does it take 100 million sperms to fertilize one egg? Because they won't stop to ask directions.";


3442,"Mothers with teenagers know why animals eat their young.";


3443,"I was thinking about how people seem to read the Bible a whole lot more as they get older. Then it dawned on me ... they were cramming for their finals.";


3444,"There are 2 times when a man doesn't understand a woman - before marriage and after marriage.";


3445,"She's so fat, she fell down and rocked herself to sleep trying to get up!";


3446,"If the answer to all questions is yes, so why not?";


3447,"Coldplay is like depression you can hear.";


3448,"Never attribute to malice what can be adequately explained by stupidity.";


3449,"Sex is a misdemeanor; the more I miss, the meaner I get!";


3450,"We've heard that ignorance of maths is growing geometrically, whatever that means.";


3451,"If someone ever intimidates you, remember that they're 70% water. Are you scared of water? Well you should be. 400,000 people drown per year.";


3452,"What's six inches long that women love? Folding money.";


3453,"Want to dance? Or should I go to hell again?";


3454,"What did the chocolate syrup say to the ice cream? ""I'm sweet on you!"" ";


3455,"Do you know what the square root of 69 is? Ate something. (8.xxxxxxx....)";


3456,"Baby you're so cute you made my page 404.";


3457,"If it's true that we are here to help others, then what exactly are the others here for?";


3458,"How do you stop a fish from smelling? Cut its nose off.";


3459,"Everyone can find one person or three cats waiting for him.";


3460,"It's so cold outside, I actually saw a gangster pull his pants up.";


3461,"One head is ok, but a whole body is much better.";


3462,"Well, this day was a total waste of makeup.";


3463,"This must be the 8th castle because I just found my princess.";


3464,"May you never leave your marriage alive.";


3465,"People who wait 4 hours to reply to my text with ""lol"" should be shot.";


3466,"My mother-in-law fell down a wishing well, I was amazed, I never knew they worked.";


3467,"If I agreed with you we'd both be wrong.";


3468,"I'm an antisocial-psychic. I can see ahead of time that I won't want to talk to you.";


3469,"I've learned that the people you care most about in life are taken from you too soon and all the less important ones just never go away.";


3470,"My track record as an adult is mostly false starts, hurdles and running around in a circle.";


3471,"My ""it's cold outside"" post just went viral on Facebook.";


3472,"Haven't seen any UFOs lately. Wondering if the galaxy is downsizing their space programs too.";


3473,"A pedigree bulldog missing. Founders  rest in peace.'";


3474,"I start every conversation with my employees by saying, ""I shouldn't be telling you this"" just so I know they will listen.";


3475,"I'm an adult. I don't cry over spilt milk unless it has coffee in it.";


3476,"The right to be heard does not automatically include the right to be taken seriously.";


3477,"To err is human, to blame it on somebody else shows management potential.";


3478,"The truth is out there; it just hasn't been indexed well.";


3479,"Why does night fall but never break and day break but never fall?";


3480,"A nice box of chocolates provide your total daily intake of calories in one place. Isn't that handy?";


3481,"If you find yourself in a hole. Stop digging.";


3482,"If you have a shitty job, you probably shouldn't lick your fingers at lunch time.";


3483,"I'm ready to start a family, in the sense that I have enough chip clips for 6 people.";


3484,"Errors have been made. Others will be blamed.";


3485,"My wife says she is no longer buying junk food for the family because, ""Everyone just eats it.";


